6,"No, Michael Jackson Isn't Bruno Mars' Dad","Michael Jackson, legendary as he was as the King of Pop, wasn't the most the popular dad in showbiz. Ever since the Berlin baby-dangling incident of '02, the media has tirelessly and unfairly portrayed him as an irresponsible and detached father (before his death, Jackson had shown remorse for the incident). This depiction was unfortunately fueled by his own erratic behavior during the final years of his life, and the sexual abuse charges that chased Jackson a few years before his death certainly didn't help with his image. This week, social media went crazy over a ""news"" article that had been circulating Facebook and Twitter like wildfire. An article published by Empire News entitled, ""DNA Results Confirm Michael Jackson Is Biological Father Of Bruno Mars,"" has unsurprisingly shocked and enraged fans of both singers across the internet. The story went on to detail how the Billionaire singer allegedly and inadvertently revealed where he got his singing genes. The article wrote that the discovery involved Mars' firing of a certain Vladimir Kershov, the singer's reported publicist. ""Vladimir Kershov, publicist of R&B singer Bruno Mars, has been fired today after he revealed a shocking secret regarding the pop and R&B singer. Kershov leaked private information that revealed that Michael Jackson is Mars' biological father."" According to Bruno's Wikipedia page, the half-Filipino singer was born to Peter Hernandez and Bernadette Bayot in 1985 and was born and raised in Honolulu, Hawaii. Meanwhile, Michael was, at the time, not involved with anyone, although he was already beginning to form a relationship with future-wife Lisa Marie Presley. While Jackson was often portrayed as a bad dad in tabloids, he was, in reality, an amazing father to his kids Michael Jr, Paris and Prince. Shortly after his death, MTV revealed never-before seen correspondence with people closest to Michael, most of whom attested to the fact that the singer was a caring and loving dad to his children. Producer and Jackson's friend Teddy Reily recalled, ""Michael] read them a book every day. When we were in Virginia during the Invincible [sessions], there was not one day missed reading the children something. So that showed me right there that he was an incredible father."" In other news, Michael Jackson's brothers continue to celebrate his musical legacy through various performances around the world. Inquisitr recently reported about the brothers' upcoming UAE concert, which is set to be attended by thousands of fans.",TRUE,http://www.inquisitr.com/1715331/no-michael-jackson-isnt-bruno-mars-dad/,Culture,Emergent
7,"Kurt Sutter Announces Plans For ‘Sons Of Anarchy’ Movie Starring Charlie Hunnam, Brad Pitt","Kurt Sutter, creator of the hit FX drama Sons of Anarchy, has announced plans to turn the popular television series into a major motion picture. Sutter, who was also a writer, producer, and director on the series, said in an interview with Hollywood Today magazine that he has long contemplated taking S.O.A. to the big screen following its run on television. “People absolutely loved the show, as did I, and I have put a lot of thought into the matter, and we are going forward with turning it into a feature film” Sutter said. Sons of Anarchy ran for seven seasons on FX, from 2008-2014, and in the process built a huge following.  Sutter said the film will star Charlie Hunnam, who played the lead character Jax Teller, as well as Ryan Hurst who played Opie Winston, and Katey Sagal as Gemma Teller. The film, which is a prequel to the storyline of Sons will also introduce fans to Jax’s father, John, who will be played by Brad Pitt. “I am most excited about bringing Brad (Pitt) on as John Teller, he is absolutely perfect for the role. The movie will take place from the day Jax was born, and leads up to the era just before Sons Of Anarchy began as a series.” Sutter also said that he is really happy to bring Ryan Hurst back as Opie Winston, and hopes fans will forgive him for killing Opie off. “Man I tell ya, when we killed Opie off, it was like the thing turned real. I’ve never gone public with this, but I’ve had people get really crazy when they see me in public,” said Sutter. “They shout at me, and they get angry – ‘You shouldn’t have killed Ope! I hope you rot in Hell!,’ that sort of thing. I had people try to run me off the road when they recognized me, although that just might be because I’m kind of a dangerous driver. Anyway, my hope is that this film will help them cope.” Sutter says pre-production on film will begin in the middle of 2015, and will begin shooting sometime in the fall. “For a movie of this scope, with this much storyline attached, you should expect to see the film by the end of 2016,” said Sutter. “In the mean time, buy all the official Sons of Anarchy merchandise you can. Every dollar goes to helping get this movie completed. Brad Pitt isn’t cheap, you know.”",FALSE,http://empirenews.net/kurt-sutter-announces-plans-for-sons-of-anarchy-movie-starring-charlie-hunnam-brad-pitt/,Culture,Emergent
10,"Twitter account attributed to Lisa Bonet was hoax, manager says","“Cosby Show” star Lisa Bonet may have posted a cryptic tweet seemingly aimed at her embattled TV dad — and it wasn’t a smiley face. “According to the karma of past actions, one’s destiny unfolds, even though everyone wants to be so lucky . . . Nothing stays in the dark 4ever!” read a tweet from the 47-year-old actress’ purported Twitter account, which was later deactivated. Bonet played Denise Huxtable on the hit NBC series starring Bill Cosby. At least 15 women — including model Janice Dickinson — have come forward to accuse the 77-year-old ­comedian of being a sexual predator. For years, bad blood was rumored to have existed between Bonet and Cosby, who was reportedly incensed by her sex scene with Mickey Rourke in “Angel Heart” in 1987 and a nude magazine photo shoot she did a year later. In 2002, tabloids reported Bonet refused to join the cast for a 10th-anniversary special, quoting an unnamed castmate as saying: “Year after year, we watched Bill throw Lisa one bone after another, and all she did was bite his hand. The rest of us were happy to be on a hit show, but Lisa didn’t seem to appreciate her good fortune.”",FALSE,http://pagesix.com/2014/11/22/are-lisa-bonets-mysterious-tweets-hinting-at-cosby-scandal/,Culture,Emergent
11,Seth Rogen to Play Apple Co-Founder Wozniak in Steve Jobs Biopic,"Seth Rogen has been set to star as Steve Wozniak opposite Christian Bale in Sony’s Steve Jobs biopic, sources confirm. Variety reported on Oct. 15 that Bale was in talks to star in “Jobs,” Sony’s biopic about the late Apple co-founder. Writer Aaron Sorkin recently confirmed the Bale casting. Jessica Chastain is being eyed for an unspecified role. Based on Walter Isaacson’s biography “Steve Jobs,” the real-life drama is directed by Oscar-winner Danny Boyle. Scott Rudin is producing the tech drama along with Mark Gordon and Guymon Casady. Sorkin, who also penned the Facebook drama “The Social Network,” has publicly said the movie will be divided into three long scenes, each taking place backstage before one of Apple’s famous product launches. Sony acquired rights following the Apple mogul’s death in 2011. Wozniak founded Apple with Jobs and Ronald Wayne and is credited with launching the Apple I and Apple II computers in the late 1970s, which had a profound impact on the microcomputer revolution. He left Apple as a full-time employee in 1987. Last year’s independently financed “Jobs” starred Ashton Kutcher as Jobs and Josh Gad as Wozniak and covered the era from 1974 to 2001 when the iPod launched. Worldwide box office was modest at $36 million. Rogen starred this year in Universal’s “Neighbors” and will be seen next with James Franco in Sony’s “The Interview.” He is represented by UTA, Principal Entertainment LA and attorney Fred Toczek.",TRUE,https://variety.com/2014/film/news/seth-rogen-steve-wozniak-steve-jobs-biopic-1201338038/,Culture,Emergent
13,Matt Taibbi Leaves Omidyar’s First Look Media,"Matt Taibbi, the star magazine writer hired earlier this year to start a satirical website for billionaire Pierre Omidyar’s First Look Media, is on a leave of absence from the company after disagreements with higher-ups inside Omidyar’s organization, a source close to First Look confirmed today. When he was hired, amid much fanfare, Taibbi’s website was meant to be the second in an envisioned fleet of titles to be published by First Look, an ambitious digital journalism company funded by Omidyar, the founder of eBay and one of the richest tech moguls in America. Like its counterpart the Intercept, launched earlier this year by Glenn Greenwald and others to pursue investigations of NSA surveillance and the intelligence world, it was a venture centered around a brand-name polemicist without much management experience. Prior to joining First Look, Taibbi made his name by gleefully skewering fat targets for Rolling Stone — most famously, he described Goldman Sachs as “a great vampire squid wrapped around the face of humanity” — and he said at the time of his departure that he was lured away by the chance to lampoon the financial industry in the “simultaneously funny and satirical voice” associated with the legendary magazine Spy. Over the succeeding months, the mission of the publication broadened to encompass political satire as well, and it brought on a number of high-profile names from the New York digital scene, including deputy editor Alex Pareene, formerly of Salon; Laura Dawn, a digital video producer who formerly worked with Moveon.org; and Edith Zimmerman, editor of the Hairpin.“Journalists should be dark, funny, mean people,” Taibbi told New York in an interview in March. “It’s appropriate for their antagonistic, adversarial role.” Omidyar originally conceived of First Look as a network of interlinking sites run by “independent” journalists, many of whom took a similarly adversarial approach to journalism. Over the last year, however, the center of gravity of the organization has shifted, as Omidyar and his Silicon Valley braintrust have exerted control over budgets and vacillated over the journalistic mission. Over the summer, Omidyar appointed a longtime confidante, John Temple — a former newspaper editor who previously led an Omidyar-financed civic journalism venture in Hawaii — to be the president for audience and products, putting him in a position above Eric Bates, the former Rolling Stone editor who was brought on as a First Look editorial director, who is close to Taibbi. The confrontational approach that made Taibbi’s name at Rolling Stone — and before that, as a co-founder of the gonzo Moscow expatriate magazine The eXile — appears to have contributed to internal trouble at First Look. Sources confirmed that Taibbi has been absent from the office for several weeks, only returning on one brief occasion to address the staff. Although those hired have been reassured that the project would continue on during the unspecified term of Taibbi’s absence, the launch date for Racket — which Taibbi indicated in September would be coming “in a month” — now appears to have been pushed off. “We have a target date but I wouldn’t make a launch date public,” said Temple, who is based in San Francisco, when reached by phone this morning. “I don’t comment about internal matters and I don’t comment on personnel matters. …  I mean we’re a private company, so why would we … no.” Taibbi’s absence is only the latest in a series of shifts inside First Look, which Omidyar founded last year, originally in response to the disclosures of NSA surveillance leaked by Edward Snowden to Greenwald and his Intercept colleague Laura Poitras. Omidyar initially committed $250 million to the project and began laying plans for a large general interest website and a number of more narrowly focused “digital magazines.” In July, the billionaire announced he was scaling back the plan for the time being, choosing instead to focus on Racket and the Intercept as prototypes for a new technological model of journalism. The Intercept has lately been publishing vigorously, breaking several major stories — federal investigators are reportedly pursuing the alleged leaker responsible for a story on the site about the government’s voluminous terrorist watch list. But Racket has been much slower to materialize, leading to rumors of staff anxiety. In August, Temple told me Taibbi’s site was experimenting with a variety of journalistic approaches — not just satire and humor but also investigative journalism. For instance, Ellen Miller, head of the campaign finance watchdog the Sunlight Foundation — a nonprofit also heavily financed by Omidyar — met with the staff over the summer to discuss how it might dig into issues of money in politics. “We’re supporting Matt in creating something unique — and it’s Matt’s,” Temple told me. “He’s building a team and there’s great esprit in Matt’s team.” Taibbi’s clashes with those at the top are likely to drive further speculation about the fate of the long-incubating project and about the journalist’s own continued involvement. Nonetheless, the site is apparently still hiring.",TRUE,http://nymag.com/daily/intelligencer/2014/10/matt-taibbi-disappears-from-omidyars-first-look.html,Culture,Emergent
14,On ESPN and Domestic Violence,"Statement from John Wildhack, ESPN EVP, Programming and Production
Contrary to published reports in Esquire, there was no panel on domestic violence ever planned for tonight's Monday Night Countdown. We will present our normal Monday Night Football pre-game show, with Suzy Kolber hosting. ESPN is proud of the work it has done covering the issue of domestic violence, and is committed to continued coverage. Much of that work has been informed by several talented female colleagues from our television and espnW platforms, including Hannah Storm, Jemele Hill, Jane McManus, Kate Fagan, Sarah Spain and more.

Here is a rundown of tonight's show.

[/pullquote]

On Monday night, during Monday Night Football's two-hour pregame show, I thought it likely that the regular commentators were going to discuss domestic abuse in the NFL. Last week, seven men, but no women, discussed Ray Rice's punishment in the opening block of Monday Night Countdown. Victims of domestic violence in America are most likely to be women aged 20-24.

When the show has updates from the field—brief reports about injuries and the upcoming game—they'll cut to female sideline reporters, Lisa Salters and, on some weeks, Suzy Kolber.

These people are not allowed at the table.

On Monday, you will hear the voices of 11 men tripping over themselves to condemn the actions of one man who knocked his wife unconscious and dragged her motionless body into a casino lobby, and another man who head-butted his wife because she would not have sex with him.

You will hear their beliefs on the commissioner who did not punish Ray Rice appropriately and whose investigation into Rice's domestic violence incident is currently unclear, and might have been intentionally obfuscated or covered up.

But you will not hear these words: ""Roger Goodell is a liar.""

You will not hear these words because ESPN has a $15.2 billion broadcasting agreement with the NFL. You will not hear these words because it would interfere with the amount of money both ESPN and the NFL can make.

You will not hear these words because ESPN has intimidated its on-air staff into standing down against domestic violence.

Last week, ESPN suspended one of its editors, Bill Simmons, for calling NFL Commissioner Roger Goodell ""a liar"" and daring his bosses to suspend him for it. They suspended him for it.

Long-tenured editors and personalities of ESPN: It is now time for you to walk out with him.

This is the kind of moment that separates a ""journalist"" from a ""commentator."" What do you want to be?

Simmons' suspension at ESPN will last three weeks—one week longer than Ray Rice's initial suspension by Goodell himself. Ray Rice punched his fiancée in the face, knocking her unconscious. Bill Simmons called the head of a corporate interest a liar. His suspension is one of the longest in the history of his company.

Simmons' ascendence is credited to his willingness to say sentences exactly like this. By refusing to wait in line or repeat pabulum and talking points all the way to a potential columnist job later in life, he gained an audience. The network hired Simmons to absorb his growing readership into its offshoot Page 2 section, developing a major success in spite of itself.

Simmons disabused the language of testosterone-soaked talking heads, and it worked. He avoided the intentionally adversarial outrage only created for TV ratings purposes, like the collection of recent controversies by Stephen A. Smith.

Before the second, damning tape in the Ray Rice incident became available, Smith initially attempted to deflect the blame of Ray Rice's domestic incident onto Rice's fiancée, Janay.

This content is imported from YouTube. You may be able to find the same content in another format, or you may be able to find more information, at their web site.

[pullquote align='C']

""What I've tried to employ the female members of my family — some of who you all met and talked to and what have you—is that: Let's make sure we don't do anything to provoke wrong actions. Because if I come—or somebody else come, whether it's law enforcement officials, your brother or the fellas that you know—if we come after somebody (who) has put their hands on you, it doesn't negate the fact that they already put their hands on you.""

[/pullquote]

Smith had seen Ray Rice dragging a lifeless body out of an elevator and assumed the victim was somehow asking for it.

He was suspended for one week for those comments. Bill Simmons was suspended for three weeks.

Not even six weeks after returning from his suspension, Smith was back on First Take, an ESPN morning debate show, having a partial statement read to him from the National Organization for Women about Roger Goodell and Ray Rice. In the statement, NOW President Terry O'Neill implored Goodell to resign. Exactly 39 seconds after hearing her words for the first time in his life, Smith said that the President for the National Organization for Women had ""lost her mind.""

This content is imported from YouTube. You may be able to find the same content in another format, or you may be able to find more information, at their web site.

[pullquote align='C']

""I'm sorry, I think this woman is off her rocker. I think she's lost her mind. That's right, I said it. This is the most ridiculous nonsense I've ever heard in my life. Roger Goodell deserves to lose his job?"" he said. ""That's crazy. That's crazy.""

[/pullquote]

It was a temper tantrum. Smith was not suspended. Simmons was suspended for three weeks. ESPN has no affiliation with the National Organization for Women. ESPN has a broadcasting agreement with the NFL until 2021.

Still, this week, ESPN's ombudsman Robert Lipsyte called this ""ESPN's finest hour during my tenure.""

Last night, Lipsyte defended Simmons' suspension with this sentence: ""Bill Simmons has no license to call him (a liar) without more justification than 'I'm just saying it.'""

Six weeks ago, this is how Stephen A. Smith defended advocating for the discussion of ""the elements of provocation"" that could lead to a man hitting a woman: ""I don't think that's broached enough, is all I'm saying.""

Bill Simmons was suspended for three weeks. Stephen A. Smith was suspended for one.

In the old boys club of sports media—one with no room for reflection and one that empowers only those who can speak about a base emotion in the fastest and loudest way—Simmons succeeded by writing differently. When his contract expired, Simmons was convinced to stay after ESPN promised him his own outlet, Grantland. The site has since produced thoughtful pieces from different voices—not just retired, bravado-filled athletes or 50-something male anchors who have paid their corporate dues, but also writers who would rather drill deep into statistics, experiment with art and new media, or write contemplatively, creatively and passionately, sometimes under pseudonyms.

Grantland finally allowed for the journalism and opinions of, basically, anyone else.

When female contributors write features for Grantland, they are equal—another voice amidst other smart ideas. Women at Grantland are not cast aside to a separate, less-visited section of their website. That's precisely what happens at ESPN proper, the home of ESPNW—a well-intentioned, largely ignored property at the bottom of ESPN.com, called upon only when ""women's issues"" affect sports.

This is the kind of tokenism that affected FoxSports.com's Katie Nolan. In August, before the elevator footage of Ray Rice's domestic abuse incident was released, Nolan had the chance to ask Roger Goodell about why he didn't suspend Rice for more games, based on the first video. She didn't. ""I'm really going to hear about it from my bosses,"" she said. ""It's really not my role,"" she said. ""I played the role that had been assigned to me,"" she said.

A month later, she understood this to be a part of a culture of quiet repression. ""Women in sports television are allowed to read headlines, patrol sidelines and generally facilitate conversation for their male colleagues,"" she said. ""Sometimes they even let us monitor the Internet from a couch.""

She said all of this in a video on FoxSports.com. She ended it with, ""I'm ready when you are, Fox.""

This content is imported from YouTube. You may be able to find the same content in another format, or you may be able to find more information, at their web site.

She was not suspended. She was applauded on the company's website.

And that is the problem with ESPN and the old-wave of sports media: Sports are not now being infiltrated by ""women's issues"" that demand one-off responses. Women are half the population of the world—and sports are a part of that world.

There are 11 seats at the table at ESPN. All of them go to men. Women get their own table, but only sometimes—and ESPN has placed that table where no one can hear them.

ESPN personalities—even those 11 men—have spent the last two weeks on television defending their position atop a moral high-ground. Each retired player and 60-year-old man has had his chance to spout tough talk about how he would never personally commit or condone domestic violence.

Now that their company is standing behind—as ESPN anchor Keith Olbermann put it—""an enabler of men who beat women"" instead of an employee, where have these personalities gone?

They are silent.

Long-tenured editors and personalities of ESPN: Those condemnations mean nothing if you don't stand up for your ideals, your integrity, and the rights of women when your paycheck is on the line.

It means you, too, are just like your bosses: When faced with reporting the truth or collecting a paycheck—even at the most critical moment of your journalistic career—you will take the paycheck.

It means every word spoken about morality from now on is simply just posturing to protect your public image.

It means you are not a journalist. It means you are a commentator, for now and forever.

So stand up. You'd stand for the defining issues of the moment: Corporate entanglement, equal rights, the idea of journalism, and your own integrity.

You would be vindicated in the eyes of history during this very tiresome moment. You would be standing for the truth.",FALSE,https://www.esquire.com/news-politics/news/a30180/espn-has-a-women-problem/,Culture,Emergent
15,Has The Batman Vs. Superman Batmobile Been Stolen In Detroit?,"The scuttlebutt from sources in Detroit is that one of the Batmobile models being used in the filming of Batman Vs. Superman has gone missing, believed stolen. It would not be the first time a Batmobile has been nicked in Detroit. Though that was just a $200 replica of the TV Series version back in 2o10. Anyway, if you are driving around and get overtaken by this……do get in touch. Warner Bros representatives did not respond to inquiries.",FALSE,https://bleedingcool.com/movies/has-the-batman-vs-superman-batmobile-been-stolen-in-detroit/,Culture,Emergent
