0,EXPLAINER: Will burglar alarms still work after 3G shutdown?,"NEW YORK (AP) — As telecom companies rev up the newest generation of mobile service, called 5G, they’re shutting down old networks — a costly, years-in-the-works process that’s now prompting calls for a delay because many products out there still rely on the old standard, 3G.

AT&T is scheduled to be the first carrier to shut down its 3G network on Feb. 22. T-Mobile will shut down its 3G network by summer and Verizon in December.

The home-alarm industry has asked the Federal Communications Commission, the U.S. regulator, to delay AT&T’s network sunset until December. The FCC is monitoring the 3G phase-out and working to “implement safeguards” for older phones and other devices, spokesperson Paloma Perez said late Monday.

Verizon has already pushed back its shutdown — twice — from an original target date in 2019, saying customers needed more time to update their devices. T-Mobile has also delayed the shutdown of the Sprint 3G network it acquired in 2020, to the end of March; it’ll shut down the T-Mobile 3G network by July 1.

TECHNOLOGY
Cyberattacks knock out sites of Ukrainian army, major banks
Macron: Europe needs to defend its sovereignty in space
Online harassment, real harm: Fixing the web's biggest bug
EXPLAINER: Will burglar alarms still work after 3G shutdown?
WHY IS 3G SHUTTING DOWN?

First, some history. AT&T’s 3G network launched in the U.S. in 2004; later that decade it was the exclusive carrier for early iPhones, helping usher in the first phase of the smartphone era. The networks we currently rely on for video streaming, social apps, Uber and other must-haves of the modern era mostly use the subsequent 4G standard.

For the carriers, shutting down 3G is an efficiency move. As they upgrade to the latest technology, they shut off outdated networks and use the freed-up bandwidth for newer — and what they hope will be more profitable — services.

WHAT IF I HAVE AN OLDER PHONE?

People with older phones that aren’t compatible with 4G will have to upgrade; once 3G shuts down, those phones won’t work for calls or texting. AT&T says it has reached out to offer its customers free replacements via letters, emails and texts. Spokesperson Jim Greer said fewer than 1% of AT&T’s consumer devices, including phones, tablets and watches, will lose cellular service, but declined to say how many devices that is. The company reported about 196 million phones and connected devices using its network in the most recent quarter.

WHAT ABOUT OTHER DEVICES?

Industry groups have also raised concerns about other products that will need to be replaced or updated — everything from home fire alarms to ankle bracelets used by law enforcement. It’s not certain how many outdated products are out there, or how big a deal it would be if updates take place after Feb. 22.

The alarm industry and other companies say they have had issues replacing devices even though they’ve known about the coming shutdown for years. Recent setbacks include both pandemic-triggered supply-chain issues and customers hesitant to let technicians into their homes during the pandemic.

HOW MANY OUTDATED PRODUCTS ARE OUT THERE?

It’s not really clear. An alarm-industry lobbying group estimates that 1.5 million customers still need to upgrade their fire or burglar alarms, while about half a million have medical alert devices that run on 3G; it said most rely on AT&T service. While an unnetworked fire alarm will still sound an alarm if there’s smoke, it won’t be able to contact the fire department. Likewise, burglar alarms won’t route to emergency responders if triggered. Not all providers say there’s an issue. ADT said in November that it was on track to update its AT&T customers by February; a spokesperson declined to offer an update on Sunday.

AARP, the advocacy group for adults over 50, is also concerned that users of medical alert systems — those necklaces and bracelets, like Life Alert — that connect users to emergency call centers won’t know their gadgets don’t work anymore or won’t be able to replace them in time.

HOW SHOULD I PREPARE?

Check your phone to make sure it will still work. Here’s an AT&T list of devices that the carrier says will work normally after Feb. 22. Call the companies that make or service your burglar and fire alarms and personal medical alert systems to see if any need an update. If so, schedule a service visit immediately or get a new device shipped.

OK, DONE. ANYTHING ELSE I SHOULD WORRY ABOUT?

A few. One manufacturer of ankle bracelets for people on probation, parole or pre-trial release said it hasn’t been able to update many 3G-reliant devices. A premature shutdown could potentially allow tens of thousands of offenders like child abusers, sex offenders and drunk drivers to go unmonitored while out of prison, Alcohol Monitoring Systems wrote in an August FCC filing. The company did not respond to questions.

Zonar, which provides GPS and other services for buses and trucks, says tens of thousands of vehicles will be affected. Trucks that aren’t upgraded may have to be idled if drivers can’t electronically log their hours as federal rules require. Zonar has a workaround for the trucking industry, but not all customers have placed orders for it, said Susan Corscadden, a company marketing executive.

Affected school districts could also lose their ability to track the location of school buses, while their drivers may not be able to use GPS systems for directions. The National Association for Pupil Transportation seconded these concerns in a September filing, although Noelle Ellerson Ng, the group’s legislative liaison, said in an interview that she hasn’t heard school superintendents raise the issue.

SO DOES THE SHUTDOWN POSE A SERIOUS PUBLIC-SAFETY THREAT?

It’s unclear. “There’s a lot of uncertainty about the impact and about how many people are affected,” said Tom Kamber, the executive director of Older Adults Technology Services, a nonprofit affiliated with AARP. The AARP has asked the FCC to delay the AT&T shutdown until December.

Public Knowledge, a public-interest group, also urged the FCC to block the February shutdown unless AT&T can show that it has made sure that essential services won’t be disrupted or that it can restore service immediately if problems arise.

SO WHY NOT DELAY?

AT&T says that delaying the shutdown would hurt its 5G rollout, degrading its customers’ ability to use their service and causing more dropped calls. The company argues that the alarm companies have had years to upgrade their customers’ devices. The company also says the FCC doesn’t have the authority to stop its shutdown.",TRUE,https://apnews.com/article/technology-business-federal-communications-commission-967e798ec0bb8074f1815b06cf01a0c1,Technology,AP
0,GM to restart Chevy Bolt factory after battery fire recalls,"DETROIT (AP) — General Motors says it will start making Chevrolet Bolt electric vehicles again in early April after an eight-month pause due to a series of battery fire recalls.

The automaker says Tuesday that battery supplier LG Energy Solution is now making enough to supply replacement modules for the recalls as well as to resume production.

The company will start making hatchback and SUV versions of the Bolt on April 4 at a factory north of Detroit. Those should start reaching dealers a few weeks later. Vehicles on dealer lots at the time of the recalls can be sold once battery modules are replaced.

In August GM expanded a previous recall to more than 140,000 Bolts sold worldwide since 2016 because battery manufacturing defects could cause the vehicles to catch fire.

The company said at the time that in rare cases, batteries that have two manufacturing defects can cause fires even when parked.

The recall follows reports of 13 battery fires, GM said, which can occur when both defects are present in the battery modules.

TECHNOLOGY
Cyberattacks knock out sites of Ukrainian army, major banks
Macron: Europe needs to defend its sovereignty in space
Online harassment, real harm: Fixing the web's biggest bug
EXPLAINER: Will burglar alarms still work after 3G shutdown?
In October LG agreed to reimburse GM $2 billion for the recall costs, and the company remains in a joint venture with the company to build batteries for its next generation of electric vehicles.

The battery fires and recalls have been an embarrassing setback for GM, which has lofty goals of switching from internal combustion to battery powered vehicles. GM sold just under 25,000 Bolts in the U.S. before telling dealers to stop selling them due to the recall in August.

To capture U.S. electric vehicle market share leadership, GM plans to spend $35 billion to roll out more than 30 new battery vehicles globally by 2025, including about 20 in North America. The company has said it aspires to make only electric passenger vehicles by 2035.

GM has said it plans to overtake Tesla as the world’s leading seller of electric vehicles. Tesla sold just under 353,000 EVs in the U.S. last year, according to estimates from Motorintelligence.com.

GM has started selling its Hummer large electric vehicles and plans to start making a Cadillac SUV next month. A Chevy Silverado electric pickup is to follow in 2024.

By the end of the decade, GM expects $90 billion in additional annual revenue from electric vehicles.",TRUE,https://apnews.com/article/technology-business-fires-b745432ad41c3df59ac2ff445e0b73dc,Technology,AP
0,"World Economic Forum Wargames How To Push Digital ID, Vaccine Passports","A new document by the World Economic Forum (WEF) outlines how to introduce the world population to a digital ID system based on technology that will someday be “embedded in the skin.”

The 46-page document called “Advancing Digital Agency: The Power of Data Intermediaries” claims that because a digital ID will be used for authentication in virtually every aspect of your life – from financial services to travel and commerce – the technology could “enhance privacy protection” and “reduce rise of identity fraud.”


But if you dig deeper, the document goes on to explain how a digital ID won’t be used just for authentication, but also to record biometric attributes, credit and medical histories, online and purchasing behaviors, and even to control the ability to travel.


The WEF cites the widely unpopular vaccine passport as a “form of digital ID” the globalist body calls an “incredible public health asset” that “verifies” your private health information.

Such vaccine passports are used when travelling between jurisdictions and at a local level, such as when entering dining establishments or other places where proof of vaccination status is necessary. Importantly, these intermediaries provide a means of verifying status without sharing health data with the establishment per se, in a sort of zero-knowledge proof scenario whereby the trusted data intermediary verifies that the data subject is vaccinated but does not share any other information. This avoids unwanted secondary effects of the establishment sharing the data any further.

As we’ve reported, the digital ID is a key component of the WEF’s Great Reset agenda, which aims to transform the world’s economy and institutions into a global communist New World Order, where private property and free market enterprise no longer exist.

Another aspect of the digital ID and Great Reset, according to WEF founder and transhumanist Klaus Schwab, is to merge the physical, digital, and biological worlds to fundamentally change “what it means to be human.”

",FALSE,https://www.infowars.com/posts/world-economic-forum-wargames-how-to-push-digital-id-vaccine-passports/,Technology,Infowars
0,Top Chinese Whistleblower Warns CCP May Deploy Hemorrhagic Fever Virus At Winter Olympics,"The Chinese Communist Party (CCP) could use the Winter Olympics as an outbreak vector for a new and more deadly virus developed by its military bioweapons program, according to virologist Dr. Li-Meng Yan.

“The CCP is enlarging their whole military-civilian fusion network…to develop their bioweapon industry,” Dr. Yan said in a Saturday interview on the JD Rucker Show.

Dr. Yan explained that the CCP was developing more “gain of function viruses” mixed with powerful misinformation operations to sow more chaos when another outbreak occurs.

And a good testing ground for this next phase of their bioweapons program is the 2022 Winter Olympics in Beijing, Dr. Yan claims.

“Intelligence also shows China would launch such bio-attacks during the Winter Olympics,” Dr. Yan said.

“So the first thing is, the Winter Olympics is a great opportunity for the Chinese Communist Party,” she continued. “People [gather] somewhere, and then within a short while spread the bioweapon all over the world and it’s difficult for you to trace the origin.”

“Multiple sources also told me that the CCP are trying more bioweapons, especially the virus that causes hemorrhagic fever,” she said, such as Ebola, Lassa, Marburg, or the hantavirus, which can cause 50% mortality “without good treatment.”

Dr. Yan then described how the CCP recently locked down the northwest Shaanxi province after cases of hemorrhagic fever were recently reported, which the CCP claimed was simply an isolated outbreak of COVID-19.

“Our sources showed that this lockdown in Xian is a military drill. So there is not only one type of hemorrhagic fever virus released,” Dr. Yan said, adding that the military separated the patients who were experiencing different symptoms from one another, such as Marburg symptoms.

“Such patients were sent to the military hospital, and other people didn’t even notice,” she said.

Several cases of hemorrhagic fever were even reported in the UK just days ago, marking the first time the illness was found in the country in over a decade.

Dr. Yan claimed the CCP has discovered an antidote to these new deadlier hemorrhagic fever viruses: a Johnson & Johnson drug called Darzalex (daratumumab), an expensive drug currently used to treat multiple myeloma.

“This is not a common drug like hydroxychloroquine,” she said, explaining that China plans to “kidnap” these antidotes all over the world once the “panic” from their hemorrhagic fever virus outbreak ensues.

Symptoms of hemorrhagic fever, depending on the virus, range from high fever and bleeding from the eyes and mouth, muscle and joint pain, nausea and vomiting, shock, and even death in many cases.

Given Dr. Yan’s credentials and high credibility after blowing the whistle on the origins of COVID-19 and the CCP’s military bioweapons program in 2020, this information is particularly alarming and hopefully some U.S. lawmakers will take her warnings seriously.",FALSE,https://www.infowars.com/posts/top-chinese-whistleblower-warns-ccp-deploying-hemorrhagic-fever-virus-at-winter-olympics/,Medical,Infowars
0,AI ‘Nanny’ Being Created By Chinese Scientists To Grow Babies In Robot Wombs,"The artificial intelligence nanny has arrived. Robots and artificial intelligence (AI) may now be used in conjunction to optimize the generation of human life, marking a significant milestone in the science.

Robotics and artificial intelligence can now assist in the development of newborns via the use of algorithms and artificial wombs, which is eerily similar to what we see in the cult classic, The Matrix.

According to the South China Morning Post, Chinese experts in Suzhou have pioneered the development of the latest technological breakthrough. However, there are concerns about the ethical implications of raising human beings in an artificial environment.

The discoveries were published in the peer-reviewed Journal of Biomedical Engineering by Suzhou-based scientists. The AI nanny, according to the researchers, might aid in the growth of human kids in a “long-term embryo culture device.”

This artificial womb is a big machine containing compartments for individual fetuses. The infants will be fed as they would be in a real womb if they are in the chamber, which will be filled with an optimized mix of “nutritious fluids.”


A shocking video reveals the tyranny of Communist China in 2022.

In what seems sort of eugenics-y, a record of embryo health and “developmental potential” will be kept on file by the software over the duration of the embryo’s development.

It probably won’t happen any time soon..
At the moment, the new technology is being utilized to assist in the development of animal embryos that are developing into fetuses in the laboratory. This is due to the fact that the act of experimenting on human embryos older than two weeks is prohibited under international law.

Additionally, as the SMCP points out, surrogacy is prohibited in China. Because artificial wombs would effectively convert a hospital or laboratory into a mother under Chinese legislation, the technology is unlikely to be deployed in the area anytime soon.

Having said that, the development of artificial wombs is not a new concept. While this is not a new discovery, bringing the technology into human mass production and mixing it with ranking AI is, and it is a development that is quite dystopian sounding.

Of course, not everything is a hopeless dystopia..
Although the thought of artificially developing human infants is a far-fetched one, there are certain advantages to it. In the past, for example, the process of producing kids within people has been a lengthy, drawn-out, and unpleasant process, and this could potentially aid mothers who would like to have children, but are currently unable to, without having to use a human surrogate. After all, the population is about to start shrinking by the billions by the end of the century and fertility rates around the globe are collapsing at a frightening rate. 

This seems like more of a “when” rather than an “if”..
When artificial human growth becomes available, it will enable couples who would otherwise be at danger during delivery to have children. Adoption is also an option for thousands of children currently in foster care who may be placed in permanent families.

CLICK HERE to watch our live feed that’s now streaming 24/7 on GETTR! Also, be sure to follow Alex Jones and Banned.video on GETTR for breaking news and exclusive information!",FALSE,https://www.infowars.com/posts/ai-nanny-being-created-by-chinese-scientists-to-grow-babies-in-robot-wombs/,Technology,Infowars
0,CDC Director Now Says To Just Do Whatever Texas Did 12 Months Ago,"ATLANTA, GA—The CDC has released new guidance for how states should deal with the pandemic by telling everyone to just go ahead and do what Texas did 12 months ago. 

""Yeah, we were pretty much wrong about literally everything. Sorry about that!"" said CDC Director Rochelle Walensky to the press. ""It would seem the official science has changed. We should now be doing whatever Texas has been doing for over a year. To be clear, this doesn't mean Texas is good. They're still bad and we hate them. We just want to make sure that's understood.""

The gathered journalists then began to scream towards the sky and hyperventilate at the thought of returning to some degree of normalcy, as well as the thought of Texans actually being right about something.

""I recommend we just drop all this and pretend it never happened,"" said Walensky. ""I'm still gonna be paid my salary, right?""",FALSE,https://babylonbee.com/news/cdc-director-now-says-to-just-do-whatever-texas-did-12-months-ago,Medical,Babylon Bee
0,Scientists Reveal The True Immunity Was Inside You All Along,"WORLD—People around the world are inspired as scientists recently revealed that the immunity we've all been searching so hard for was inside of us all along.

""If you've already recovered from COVID, you have a natural immunity that is more effective and longer-lasting than Pfizer's vaccine,"" said one Israeli scientist. ""As it turns out, the very thing we desired with all our hearts was right in front of us the whole time, and we didn't even know it. Actually, inside of us. It's called the immune system. We totally forgot that was a thing."" 

Experts now believe no one took the time to notice the inner strength contained in their immune systems, because it was dorky and shy and wearing glasses and had its hair in a bun. Then one day, it took off its glasses and let down its hair and everyone realized natural immunity was actually super hot.

""For so long, I've looked for strength and confidence in the arms of Pfizer and Moderna,"" said local COVID survivor Matt Frunkle, ""but now I realize I have everything I need, right here inside me,"" he said, pointing in the general direction of his primary lymphoid organs. ""I've never felt so powerful."" 

A spokesperson from Pfizer responded by saying ""You'll regret saying no to us! If we can't have you, no one will!"" 
",FALSE,https://babylonbee.com/news/scientists-reveal-the-true-immunity-was-inside-you-all-along,Medical,Babylon Bee
0,Biden orders release of Trump White House logs to Congress,"WASHINGTON (AP) — President Joe Biden is ordering the release of Trump White House visitor logs to the House committee investigating the riot of Jan. 6, 2021, once more rejecting former President Donald Trump’s claims of executive privilege.

The committee has sought a trove of data from the National Archives, including presidential records that Trump had fought to keep private. The records being released to Congress are visitor logs showing appointment information for individuals who were allowed to enter the White House on the day of the insurrection.

In a letter sent Monday to the National Archives, White House counsel Dana Remus said Biden had considered Trump’s claim that because he was president at the time of the attack on the U.S. Capitol, the records should remain private, but decided that it was “not in the best interest of the United States” to do so.

She also noted that as a matter of policy, the Biden administration “voluntarily discloses such visitor logs on a monthly basis,” as did the Obama administration, and that the majority of the entries over which Trump asserted the claim would be publicly released under the current policy.

JOE BIDEN
Biden taps 2 to step in for ousted science adviser Lander
Opposition from GOP senator threatens Biden judicial pick
Former Michigan GOP chair Cox criticizes Jan. 6 subpoena
COVID a wildcard as Biden prepares for State of the Union
A Trump spokesman did not immediately respond to a request for comment on the decision.

The Presidential Records Act mandates that records made by a sitting president and his staff be preserved in the National Archives, and an outgoing president is responsible for turning over documents to the agency when leaving office. Trump tried but failed to withhold White House documents from the House committee in a dispute that was decided by the Supreme Court.

Biden has already made clear that he is not invoking executive privilege concerning the congressional investigation unless he absolutely must. Biden has waived that privilege for much other information requested by the committee, which is going through the material and obtaining documents and testimony from witnesses, including some uncooperative ones.

The committee is focused on Trump’s actions from Jan. 6, when he waited hours to tell his supporters to stop the violence and leave the Capitol. Investigators are also interested in the organization and financing of a Washington rally the morning of the riot, when Trump told supporters to “fight like hell.” Among the unanswered questions is how close organizers of the rally coordinated with White House officials.

Investigators also are seeking communications between the National Archives and Trump’s aides about 15 boxes of records that the agency recovered from Trump at his Florida resort and are trying to learn what they contained.

Meanwhile, White House call logs obtained so far by the House committee do not list calls made by Trump as he watched the violence unfold on television on Jan. 6, nor do they list calls made directly to the president.

That lack of information about Trump’s personal calls is a particular challenge as the investigators work to discern what the then-president was doing in the White House as supporters violently beat police, broke into the Capitol and interrupted the congressional certification of Democrat Joe Biden’s election victory.

There are several possible explanations for omissions in the records, which do not reflect conversations that Trump had on Jan. 6 with multiple Republican lawmakers, for example. Trump was known to use a personal cell phone or he could have had a phone passed to him by an aide. The committee is also continuing to receive records from the National Archives and other sources, which could produce additional information.",TRUE,https://apnews.com/article/joe-biden-donald-trump-united-states-congress-dana-remus-833698eba6e222cdc3dfa128c44b0c99,Politics,AP
