index from original dataset,Original Article Link,Original article text,Verdict,Snopes/politifact/emergent article title,Category,Fact Checking Website
516,United States health care facilities face an intravenous bag shortage because of the devastation wreaked by Hurricane Maria in September 2017.,"SAN JUAN, PUERTO RICO — When things went bad during Hurricane Maria, they went bad all at once, across this entire island. Suddenly, everything was dysfunctional, including the power grid, the cellphone towers, the banking system. Even the disaster managers, the professionals in charge of responding to hurricanes, were forced to evacuate the buildings where they had sheltered during the powerful storm.

They shifted operations to the convention center here, an improvised maneuver that was just one of the reasons the government struggled to meet the challenges Maria presented. They were in the dark. The island’s residents were in the dark. No one knew the extent of what had happened — or what was happening — for days.

“Everything collapsed,” said Héctor Pesquera, the Puerto Rico governor’s director of safety and public protection. “Everything collapsed simultaneously.”

Nearly two weeks after Maria caused a historic catastrophe and thrust Puerto Rico into a humanitarian crisis, President Trump on Tuesday is scheduled to make his first visit to the island since the storm hit on Sept. 20.

Trump is expected to meet with Gov. Ricardo Rosselló, who has repeatedly expressed appreciation for federal support from Washington. It is unclear whether Trump will encounter San Juan Mayor Carmen Yulín Cruz, who has sharply criticized the federal effort, saying that Puerto Ricans are dying while the nation’s bureaucracy stumbles.

Trump has tweeted attacks on Cruz’s leadership, and the president has repeatedly said that stories highlighting the slow response to the crisis are fake news.

Watch aerial views of damaged Guajataca dam in Puerto Rico
The Guajataca dam, in Northwest Puerto Rico, sustained damage from Hurricane Maria prompting authorities to issue evacuation orders for those living downstream. (Hector Santos Guia, Whitney Leaming/The Washington Post)
That view was echoed, if in a more subtle way, by the Federal Emergency Management Agency’s administrator on Monday after he flew to the island and, as he told reporters, saw signs of civic vibrancy in San Juan. William “Brock” Long said he managed to get a cellphone signal when he was 20 minutes outside the capital and heading to a remote area.

“As we were going down the road, I saw numerous fuel trucks with security, I saw numerous water trucks with security,” he said. “I saw a lot of resilient Puerto Ricans. I saw neighbors helping neighbors. I didn’t see anybody in a life-threatening situation at all.”

[Trapped in the mountains, Puerto Ricans don’t see help, or a way out]

The statutory requirements and protocols of disaster management are complex. The Defense Department has authority to send some of its assets where it sees fit, and in the case of Hurricane Maria did not initially deploy as many ships, sailors and soldiers as it could have. But the Defense Department is supposed to support, and follow the guidance of, FEMA. FEMA, in turn, is supposed to support the local and state (and in this case, territory) government.

Political sensitivities enter the calculation — with governors invariably wanting to show command and control — as was the case with Rosselló, who on Thursday took pains to say that the government of Puerto Rico is fully in charge of the Maria disaster response.

“The last thing a political leader wants to admit is that the problem is beyond their control,” said retired Coast Guard Adm. Thad Allen, who played a critical role in the federal responses to Hurricane Katrina and the 2010 oil spill in the Gulf of Mexico. “There has to be a frank, unvarnished conversation about the scope of the problem and how to deal with it. It is politically hard but operationally essential.”


Cars in Vega Alta pass power-line poles downed by Hurricane Maria. (Ricardo Arduengo/AFP/Getty Images)
Even before Maria, Puerto Rico had been hobbling along economically amid a financial crisis and at the same time convulsing politically. Now comes the longer-term question of whether the island can rebuild its economy and stave off wholesale flight of its residents to the mainland.

Rosselló, trying to steer attention toward the broader issues facing Puerto Rico, said on Sunday: “I invite you to reflect on why Puerto Rico is in the current state of disadvantage and inequality. It’s not something that happened just a few months or few weeks before this storm. It is a condition that has happened for more than a century in Puerto Rico. . . . I invite you to reflect on the reality that even after the storm hit Puerto Rico, even when it was evident that it was a disaster in the United States, only half of our U.S. citizens knew that Puerto Ricans were U.S. citizens.”

Roselló and other officials have not denied that the government struggled to provide food, water, medicine and fuel in the wake of Maria, but they have pointed to the challenges of being an island 1,000 miles from the mainland, as well as the communication breakdowns they experienced.

The scale of the disaster became clear only when mayors from across the island arrived in San Juan on Sept. 23, three days after the storm, for a meeting at the convention center at which they delivered dire reports in person. The U.S. government did not ramp up all of its capabilities until six days had passed. Last Tuesday, the Pentagon dispatched an Army one-star general to the island and then quickly elevated that command by sending in a three-star general.

[‘If anyone can hear us . . . help.’ Puerto Rico’s mayors describe widespread devastation from Hurricane Maria]

“Every day we get more and more situational awareness,” said John Rabin, the acting administrator for the FEMA division that oversees Puerto Rico. “As soon as we recognized there was a need for more resources and more capability, we ordered up that proverbial bigger boat.”

Asked if the response was slow, he went silent for a few beats.

“It’s not that it was ‘slow’; it’s ‘complex,’ is the way I would describe it,” Rabin said.

He cited one example of the way the response is evolving: FEMA and the Puerto Rico emergency managers sent relief supplies to 11 locations around the island. But the lack of communication meant that many people were not showing up for the supplies. Officials since have been using military helicopters to carry aid to rural locations.

The difficulty in responding to Maria has revealed how unique each disaster is — and how resistant to a one-size-fits-all approach. Hurricane Harvey, for example, created a flooding disaster in Houston and other cities in southern Texas, and thousands of people had to be rescued from their homes, often by civilians using private boats.

Isolated by Hurricane Maria, Utuado's residents seek help, and a way out
Residents of Puerto Rico's municipality of Utuado are trapped by landslides and broken roads after Hurricane Maria. (Video: Ashleigh Joplin, Whitney Leaming, Zoeann Murphy/Photo: Michael Robinson Chavez/The Washington Post)
For Maria, numerous Coast Guard and FEMA urban-search-and-rescue teams were on hand or arrived quickly. But it soon became clear that what people needed most were life-sustaining provisions — including water, food and diesel fuel for generators — that the search-and-rescue teams didn’t have.

Senior officials in the Pentagon debated sending additional assistance in the first few days after the storm, including deploying a 1,000-bed hospital ship, the USNS Comfort, under their own authority. They decided instead to fill requests from the Puerto Rico government to send a couple of 50-bed hospital units that could be set up on shore.

Long visited Puerto Rico last Monday, and afterward the Pentagon’s effort changed. The next day Long appeared at the White House and announced the deployment of the Comfort.

Several U.S. military officials with knowledge of Puerto Rico operations said afterward that they hadn’t known about the ship’s deployment. The Comfort was not yet ready to sail.

Military officials said they have filled every request they have received in a timely fashion. The Navy had two amphibious combat ships, the USS Kearsarge and the USS Oak Hill, already in the region in response to Hurricane Irma, and after maneuvering to avoid Maria they sailed to Puerto Rico with a complement of Marines and sailors aboard. The Coast Guard had at least nine ships off the Puerto Rico coast shortly after the storm.

The unpredictable path of the storm played a role in the decision to send some ships, notably the USS Iwo Jima and USS New York, to ports on the mainland rather than to Puerto Rico in advance of Maria, the officials said. When pressed, they acknowledged that the ships could have steered clear of the storm while at sea and responded to the storm sooner.

As of Monday, there were 10 Army helicopters, 17 Navy and Marine Corps helicopters, and 10 National Guard helicopters involved in the Maria response, with an additional 12 Army Black Hawk helicopters and four MV-22 Osprey arriving soon, the Pentagon said.

Lamothe and Achenbach reported from Washington.",TRUE,https://www.snopes.com/fact-check/did-maria-cause-an-iv-bag-shortage/,Medical,Snopes
546,Does the 2017 Tax Reform Bill Help Private Schools and Hurt Public Schools?,"The SEC’s Office of Investor Education and Advocacy is issuing this Investor Bulletin to provide investors with background information on 529 plans. Please also see our companion Bulletin for a few questions to consider before opening a 529 plan account. 

What is a 529 plan?

A 529 plan is a tax-advantaged savings plan designed to encourage saving for future education costs. 529 plans, legally known as “qualified tuition plans,” are sponsored by states, state agencies, or educational institutions and are authorized by Section 529 of the Internal Revenue Code. 

There are two types of 529 plans: prepaid tuition plans and education savings plans. All fifty states and the District of Columbia sponsor at least one type of 529 plan. In addition, a group of private colleges and universities sponsor a prepaid tuition plan. 

What are the differences between prepaid tuition plans and education savings plans? 

Prepaid Tuition Plans. Prepaid tuition plans let a saver or account holder purchase units or credits at participating colleges and universities (usually public and in-state) for future tuition and mandatory fees at current prices for the beneficiary. Prepaid tuition plans usually cannot be used to pay for future room and board at colleges and universities and do not allow you to prepay for tuition for elementary and secondary schools.

Most prepaid tuition plans are sponsored by state governments and have residency requirements for the saver and/or beneficiary. Prepaid plans are not guaranteed by the federal government. Some state governments guarantee the money paid into the prepaid tuition plans that they sponsor, but some do not. If your prepaid tuition payments aren’t guaranteed, you may lose some or all of your money in the plan if the plan’s sponsor has a financial shortfall. In addition, if a beneficiary doesn’t attend a participating college or university, the prepaid tuition plan may pay less than if the beneficiary attended a participating college or university. It may only pay a small return on the original investment.

Education Savings Plans. Education savings plans let a saver open an investment account to save for the beneficiary’s future qualified higher education expenses – tuition, mandatory fees and room and board. Withdrawals from education savings plan accounts can generally be used at any college or university, including sometimes at non-U.S. colleges and universities. Education savings plans can also be used to pay up to $10,000 per year per beneficiary for tuition at any public, private or religious elementary or secondary school.  

A saver may typically choose among a range of investment portfolio options, which often include various mutual fund and exchange-traded fund (ETF) portfolios and a principal-protected bank product. These portfolios also may include static fund portfolios and age-based portfolios (sometimes called target-date portfolios). Typically age-based portfolios automatically shift toward more conservative investments as the beneficiary gets closer to college age. If you are using a 529 account to pay for elementary or secondary school tuition, you may have a shorter time horizon for your money to grow. You also may not feel comfortable taking on riskier or more volatile investments if you plan on withdrawing the money soon. Because of these things, you may consider different investment options depending on when you plan to use the money that is invested.

All education savings plans are sponsored by state governments, but only a few have residency requirements for the saver and/or beneficiary. State governments do not guarantee investments in education savings plans. Education savings plan investments in mutual funds and ETFs are not federally guaranteed, but investments in some principal-protected bank products may be insured by the FDIC. As with most investments, investments in education savings plans may not make any money and could lose some or all of the money invested.

What fees and expenses will I pay if I invest in a 529 plan? 

It is important to understand the fees and expenses associated with 529 plans because they lower your returns. Fees and expenses will vary based on the type of 529 plan (education savings plan or prepaid tuition plan), whether it is a broker- or direct-sold plan, the plan itself and the underlying investments. You should carefully review the plan’s offering circular to understand what fees are charged for the plan and each investment option.

Prepaid Tuition Plans. Prepaid tuition plans may charge an enrollment/application fee and ongoing administrative fees.  

Education Savings Plans. Education savings plans may charge an enrollment/application fee, annual account maintenance fees, ongoing program management fees, and ongoing asset management fees. Some of these fees are collected by the state sponsor of the plan and some are collected by the plan manager. The asset management fees will depend on the investment option you select. Investors that purchase an education savings plan from a broker are typically subject to additional fees, such as sales loads or charges at the time of investment or redemption and ongoing distribution fees.

Fee Saving Tips. Many states offer direct-sold education savings plans in which savers can invest without paying additional broker-charged fees. In addition, some education savings plans will waive or reduce the administrative or maintenance fees if you maintain a large account balance, participate in an automatic contribution plan, or are a resident of the state sponsoring the 529 plan. Some 529 plans also offer fee waivers if the saver accepts electronic-only delivery of documents or enrolls online.

How does investing in a 529 plan affect federal and state income taxes? 

Investing in a 529 plan may offer savers special tax benefits. These benefits vary depending on the state and the 529 plan. In addition, state and federal laws that affect 529 plans could change. You should make sure you understand the tax implications of investing in a 529 plan and consider whether to consult a tax adviser.

Contributions. Many states offer tax benefits for contributions to a 529 plan. These benefits may include deducting contributions from state income tax or matching grants but may have various restrictions or requirements. In addition, savers may only be eligible for these benefits if you invest in a 529 plan sponsored by your state of residence.


Withdrawals. If you use 529 account withdrawals for qualified higher education expenses or tuition for elementary or secondary schools, earnings in the 529 account are not subject to federal income tax and, in many cases, state income tax. However, if 529 account withdrawals are not used for qualified higher education expenses or tuition for elementary or secondary schools, they will be subject to state and federal income taxes and an additional 10% federal tax penalty on earnings.

One of the benefits of 529 plans is the tax-free earnings that grow over a period of time. The longer your money is invested, the more time it has to grow and the greater your tax benefits. You will lose some of these potential benefits if you withdraw money from a 529 plan account within a short period of time after it is contributed.

What restrictions apply to an investment in a 529 plan?

There will likely be restrictions on any 529 plan you may be considering. Before you invest in a 529 plan, you should read the plan’s offering circular to make sure that you understand and are comfortable with any plan restrictions.

Investments. Education savings plans have certain pre-set investment options. It is not permitted to switch freely among the options. Under current tax law, an account holder is only permitted to change his or her investment option twice per year or when there is a change in the beneficiary.


Withdrawals. With limited exceptions, you can only withdraw money that you invest in an education savings plan for qualified higher education expenses or tuition for elementary or secondary schools without incurring taxes and penalties. Beneficiaries of prepaid tuition plans may only use their purchased credits or units at participating colleges or universities.  If a beneficiary doesn’t attend a participating college or university, the prepaid tuition plan may pay less than if the beneficiary attended a participating college or university. It may only pay a small return on the original investment.

Does investing in a 529 plan impact financial aid eligibility?

While each educational institution may treat assets held in a 529 account differently, investing in a 529 plan will generally impact a student’s eligibility to receive need-based financial aid for college. You may also need to consider how having money in your 529 account for future qualified higher education expenses might affect financial aid for your student’s elementary or secondary school tuition. For many families, the larger part of a financial aid package may be in loans. So, the more you can save for school, the less debt you or your student may have to incur.

Where can I find more information? 

Offering Circulars for 529 Plans. You can find out more about a particular 529 plan by reading its offering circular. The National Association of State Treasurers created the College Savings Plan Network, which provides links to most 529 plan websites. 


529 Expense Analyzer. 529 education savings plans have fees and expenses that can vary widely from plan to plan.  The Financial Industry Regulatory Authority (FINRA) has developed a tool to help you compare how these fees and expenses can reduce returns.


Underlying Mutual Funds or Exchange-Traded Funds. Additional information about a mutual fund or ETF that is an investment option in an education savings plan is available in its prospectus, statement of additional information, and semiannual and annual shareholder reports. You can obtain these documents from the plan manager for no charge. You can also review these documents on the SEC’s EDGAR database. 

Fees and Expenses. You can read about the impact fees and expenses have on your investment portfolios in the SEC’s Office of Investor Education and Advocacy’s Investor Bulletin:  How Fees and Expenses Affect Your Investment Portfolio.


Brokers or Investment Advisers. Many education savings plans’ program managers are registered investment advisers. You can search for an investment adviser and view its Form ADV on Investor.gov. You can also search for any disciplinary sanctions against a broker who may sell a 529 savings plan product, as well as information about his or her professional background and registration and licensing status, on Investor.gov. 

Financial Aid.  You can read more about federal financial aid at the U.S. Department of Education’s Federal Student Aid website. 


Other Online Resources. You can learn more about 529 plans and other education saving options on FINRA’s Saving for College website. The website contains links to other sites, including the College Savings Plan Network and the Internal Revenue Service’s Publication 970 (Tax Benefits for Higher Education). You can also find educational information about 529 plans on the Municipal Securities Rulemaking Board’s education center website.",TRUE,https://www.snopes.com/fact-check/tax-bill-private-schools/,Education,Snopes
698,Did Hurricane Irma Draw the Water Away from Beaches in Florida and the Bahamas?,"Hurricane Irma is so powerful, it sucked the ocean away from beaches in the Bahamas on Friday.
Twitter user @Piznack, one of multiple people to share videos of the strange scene, tweeted: “Y’all my family in the Bahamas said Irma sucked up all the water. There’s literally no water. The beach and ocean are gone.”
He tweeted a follow-up video that showed how the water had retreated at a beach in Long Island, Bahamas.
 Follow
piz 
‎@Piznack
Y'all my family in the Bahamas said Irma sucked up all the water. There's literally no water. The beach and ocean are gone😳

3:41 PM - Sep 9, 2017
 2727 Replies  954954 Retweets  2,0782,078 likes
Twitter Ads info and privacy

 Follow
piz 
‎@Piznack
Replying to @Piznack
Long Island, Bahamas: Where's the ocean?

4:11 PM - Sep 9, 2017
 8282 Replies  1,1761,176 Retweets  1,0131,013 likes
Twitter Ads info and privacy
Angela Fritz, The Washington Post’s deputy weather editor, confirmed this phenomenon is real and may occur during extremely powerful hurricanes such as Irma. The storm is so powerful, it can essentially change the shape of the ocean, Fritz said.
“Basically, Hurricane Irma is so strong and its pressure is so low, it’s sucking water from its surroundings into the core of the storm,” Fritz wrote.
“In the center of the storm, where there is extreme low pressure, water is drawn upward. Low pressure is basically a sucking mechanism — it sucks the air into it, and when it’s really low, it can change the shape of the surface of the ocean. As the storm draws water toward the center, it gets pulled away from the surroundings.”
Wayne Neely, a forecaster with the Bahamas’ Department of Meteorology, warned residents of Long Island and Exuma, where water had also reportedly receded from the beaches, to be careful as the ocean returned back to high levels.
“Care must be taken in this case because the water often returns with even greater fury,” Neely said in a Facebook post explaining the phenomenon.

app-facebook
Wayne Neely
15 hours ago
Why was the water receding in Long Island and Exuma during Irma? Now about the water receding....that has happened before in acklins in 1936 and this by the way is not a normal phenomena but has happened several times before but it is due to the hurricane. What happened in this case was that the low pressure of the hurricane pushed down on the water in the eye and eye wall of the hurricane which is a low pressure system at at the center of the storm which gives you the high l...
See More
130
51
154
People who had seen the water recede in the Bahamas on Friday said the water returned the next day.
Irma ripped through the Caribbean Sea and parts of the Atlantic Ocean earlier this week. It is expected to make landfall in Florida early Sunday morning. So far, the storm has killed at least 22 people and displaced thousands more.
Below are more images of the ocean disappearing from beaches in the Bahamas as far as the horizon.
View image on Twitter
View image on Twitter
 Follow
Adrian 
‎@deejayeasya
Sea gone dry 😶 #HurricaneIrma #Bahamas @weatherchannel

1:24 AM - Sep 9, 2017 · Bahamas
 121121 Replies  4,2804,280 Retweets  9,8069,806 likes
Twitter Ads info and privacy
View image on TwitterView image on Twitter
 Follow
Elpie 
‎@elpie
Bahamas 🇧🇸 These incredible photos were taken by @deejayeasya
The sea went out. The sea came in. #Irma #HurricaneIrma

5:18 PM - Sep 9, 2017
 1111 Replies  194194 Retweets  212212 likes
Twitter Ads info and privacy
View image on Twitter
View image on Twitter
 Follow
KB 
‎@keonavanessa
so the winds in Long Island Bahamas were powerful enough to blow the water so far back that the eye can't see. It looks as if there's no sea

6:03 PM - Sep 9, 2017
 33 Replies  3939 Retweets  2222 likes
Twitter Ads info and privacy

 Follow
Victoria Wells 
‎@Vick_Savalitta
Water receded in Salt Pond Long Island Bahamas yesterday evening. #SendItTo7 #HurricaneIrma",TRUE,https://www.snopes.com/fact-check/irma-beaches-water/,Science,Snopes
