0,Amazon reports strong 4Q results despite supply chain snags,"NEW YORK (AP) — Amazon is reporting strong fourth-quarter sales and profits even as the online behemoth continues to contend with surging costs tied to a snarled supply chain and labor shortages.

The company, based in Seattle, also raised its annual prime membership fee to $139 per year from $119. This is the first time Amazon has raised the price of Prime membership since 2018.

The company reported a profit of $14.32 billion, or $27.75 per share, for the three-month period ended Dec. 31, 2021. That compared with a profit of $7.22 billion, or $14.09 per share, a share, during the year-ago period. Revenue rose 9% to $137.41 billion, the company’s fifth consecutive quarter of revenue topping $100 billion.

Analysts surveyed by FactSet, however, on average expected $137.68 billion in quarterly revenue and per-share earnings of $3.61 per share.

The company said that sales are expected to be between $112 billion and $117 billion for the current fiscal quarter. Analysts were expecting $120.93 billion, according to FactSet estimates.

Amazon was one of the few retailers that has prospered during the COVID-19 outbreak: As physical stores selling non-essential goods temporarily or permanently closed, homebound people turned to Amazon for everything from groceries to cleaning supplies.

But growth has slowed as newly vaccinated Americans feel comfortable going out. And the company, like many others, are dealing with global supply chain issues and shortages of workers.

Shares rose more than 13% in after hour trading when Amazon released its results.",TRUE,https://apnews.com/article/technology-business-earnings-4a12034ffd40cc68dbe7601aa10f3ab0,"Business, Technology",AP
0,"Meta, formerly Facebook, faces historic drop as stock tanks","Meta is putting a lot of virtual eggs — and billions of dollars — into the metaverse basket, and Wall Street is pretty anxious about it.

Shares of the company formerly known as Facebook saw a historic plunge Thursday after the social media giant reported a rare profit decline due to a sharp rise in expenses, shaky ad revenue growth, competition from TikTok and fewer daily U.S. users on its flagship platform.

At the same time, it invested more than $10 billion in CEO Mark Zuckerberg’s ambitious plan to transform Meta Platforms Inc. into a virtual reality — actually, make that “metaverse-based” — company.

Meta’s shares fell more than 26% to $237.76 in afternoon trading Thursday, lopping more than $230 billion off the company’s overall value, or market capitalization. That’s the largest single-day decline for a company on record.

“Meta is sacrificing its core business model for its fascination with the metaverse,” said Rachel Jones, an analyst with the research firm GlobalData. “Betting big on the metaverse isn’t a bad thing — the technology is set to be huge and provide a multitude of opportunities — but it will take at least another decade to really get going.”

TECHNOLOGY
Amazon reports strong 4Q results despite supply chain snags
Meta, formerly Facebook, faces historic drop as stock tanks
Shares of Facebook parent Meta plunge 23% on lower profits
Congress takes up controversy over 5G service near airports
While tech companies are accustomed to making big bets on futuristic-sounding ideas that sometimes become reality — and come with a huge payoff — Wall Street doesn’t like uncertainty. There’s also the inconvenient fact of Facebook’s continued difficulty in dealing with toxic real-world effects on its existing platform.

There’s “continued concern that Facebook’s past challenges will follow Meta into the metaverse,” said Mike Proulx, research director at Forrester Research. “The company has work to do to convince consumers that Meta’s expression of the metaverse is a good thing,”

Since Meta took on its new name last fall, the company has been shifting resources and hiring engineers — including from competitors like Apple and Google — who can help Zuckerberg realize his vision.

Think of the metaverse as the internet brought to life, or at least rendered in 3D. Zuckerberg has described it as a “virtual environment” in which you can immerse yourself instead of just staring at a screen. Theoretically, the metaverse would be a place where people can meet, work and play using virtual reality headsets, augmented reality glasses, smartphone apps or other devices.

It might sound like science fiction, but then again, not long ago so were computers that fit in your pocket, driverless cars and microwaves that talk to you. Technology barrels ahead whether we like it or not and, to quote a vintage Facebook motivational poster in the company’s headquarters, “fortune favors the bold.” Despite an enormous backlash to Facebook’s problems ranging from misinformation and privacy mishaps to teen mental health and hate speech, Zuckerberg continues to believe that bold bets to steer the company in new directions have generally paid off.

In a Wednesday conference call, Zuckerberg said the company’s investments this year will focus on Reels — a TikTok-esque short form video service on Instagram — as well as messaging, ads, commerce, privacy, artificial intelligence “and, of course, the metaverse.”

“Making meaningful progress across all seven of these areas is going to improve the services we offer today and will help power a social, intuitive, and entertaining metaverse,” he said. But he acknowledged that “this fully realized vision is still a ways off, and although the direction is clear, our path ahead is not perfectly defined.”

But while Wall Street’s metaverse optimism appears to fall well short off Zuckerberg’s, Meta’s rivals are ramping up their own metaverse projects. This includes Apple, Google and Microsoft, which recently bought the video game company Activision Blizzard with the hopes of accelerating its ambitions for the metaverse.

But it’s not just the big companies. According to app analytics company SensorTower, 86 apps added “metaverse” to their title or description from November 2021 through January of this year. To date, 552 mobile apps include the term “metaverse” in their title or description.

Stifel analyst Mark Kelley sought to calm investors, noting that Zuckerberg outlined not one but seven investment priorities for the company this year. He said he doesn’t think Meta’s initial goal of reaching 1 billion metaverse users is a stretch — and importantly, he believes only 40% would be gamers, signaling its broader appeal.

Meta’s stock plunge doesn’t discourage metaverse enthusiast and venture capitalist Matthew Ball, who months before Facebook’s renaming started an index fund of metaverse-related companies. Meta the company is one of the 45 stocks in Ball’s index.

“Mark’s focus on the next-generation internet is actually justified by the fact they can see in their core business that growth is slowing, that users are shifting elsewhere, and in particular, young users are shifting to these virtual and immersive worlds where they’re a small participant and where their investments are focused,” he said.

___

This story has been updated to correct a description of the fall in Meta’s market capitalization. The decline was in the billions of dollars, not millions. ",TRUE,https://apnews.com/article/technology-business-media-social-media-facebook-cf74be789988e7e48f3e2fcdf80ddfa8,"Business, Technology",AP
0,Congress takes up controversy over 5G service near airports,"Lawmakers wondered aloud Thursday how a showdown between two federal agencies over the rollout of new high-speed wireless service reached crisis proportions last month, but they were short on answers to a dispute that raised concerns about interference with key equipment on planes.

Some flights have been canceled since Verizon and AT&T turned on their new networks last month, but predictions of widespread cancellations turned out to be wrong. The Federal Aviation Administration has cleared 90% of the nation’s airline fleet to land during poor visibility at airports near 5G cell towers.

Those approvals are being made each month, plane by plane, based on the model of radio altimeter that they use to measure their height above the ground. Some “lower-performing” planes are still restricted, and a permanent fix for the entire fleet is likely at least a year away, FAA Administrator Stephen Dickson said during a hearing of the House aviation subcommittee.

The CEOs of American Airlines and United Airlines have said they don’t expect any more disruptions. However, more than half of the planes operated by regional airlines remain restricted during bad weather, said Faye Malarkey Black, president of a trade group for the smaller carriers, some of which operate flights for American Eagle, United Express and Delta Connection.

TECHNOLOGY
Amazon reports strong 4Q results despite supply chain snags
Meta, formerly Facebook, faces historic drop as stock tanks
Shares of Facebook parent Meta plunge 23% on lower profits
Congress takes up controversy over 5G service near airports
Black said cancellations are still occurring, and more than one-fourth of flights at the three major airports in the New York City areas are operated by smaller planes that can’t land there during bad weather because of restrictions related to 5G.

Verizon and AT&T agreed to two delays before launching most of their planned new 5G service on Jan. 19 except near airports, where they agreed not to turn on new cell towers for the time being.

Dozens of flights were canceled because of 5G concerns after the services went live, but widespread cancellations were avoided.

The current, temporary fix came after the White House stepped to settle a lack of cooperation between the FAA and the Federal Communications Commission that threatened to create massive disruptions for airlines and passengers.

Rep. John Katko, R-N.Y., told Dickson that FAA’s last-minute directives about operating around 5G indicates “that you really didn’t have a plan and didn’t understand the gravity of the situation ahead of time.”

Dickson said FAA couldn’t authorize low-visibility flights near the new signals until it got information from the telecom companies about the location, height and power of their 5G towers.

House Transportation Committee Chairman Peter DeFazio, D-Ore., blamed the FCC, which approved plans by Verizon and AT&T to launch faster and more reliable 5G service using the C-Band part of the radio spectrum that is close to the range used by altimeters, which are critical for landing in poor visibility.

DeFazio said he and aviation interests raised concerns about possible interference for several years, but the FCC ignored them and auctioned off 5G spectrum without ensuring there would be no interference with aviation.

“Having a dropped call is way less serious than having a dropped airplane,” he said.

The FCC has said it provided enough buffer between C-Band and radio altimeters to prevent interference.

FCC Chairwoman Jessica Rosenworcel was invited to testify but had a conflict, according to an agency spokesman, who declined to describe the conflict. He said that Rosenworcel spoke separately on Wednesday with DeFazio and the chairman of the aviation subcommittee, Rep. Rick Larsen, D-Wash.

The FCC and the telecom companies say that 40 other countries have rolled out C-Band 5G service without any reports of radio interference with planes. Aviation groups say those countries have lower-power 5G signals or impose other restrictions on the service to prevent interference, a claim that is disputed by the telecom industry.",TRUE,https://apnews.com/article/technology-business-telecommunications-transportation-federal-aviation-administration-94a3f92cf9a6f8d17874427c9a6a9b4b,Technology,AP
0,Israel upholds use of surveillance technology on protesters,"JERUSALEM (AP) — Israel’s attorney general has upheld the Shin Bet security agency’s use of mobile-phone tracking technology to monitor and threaten Palestinian protesters at Jerusalem’s most sensitive holy site last year.

The decision, which came on Tuesday, drew harsh criticism from the civil rights group that challenged the use of the technology. The group warned that it would have a “chilling effect” on the country’s Arab minority.

The attorney general’s move was in response to a complaint over a series of text messages sent out last May to hundreds of Palestinians at the height of one of the city’s most turbulent periods in years. At the time, Palestinian protesters were clashing with Israeli police at the Al Aqsa Mosque in violence that helped spark an 11-day war between Israel and Hamas militants in the Gaza Strip.

Using its tracking technology, the Shin Bet sent a text message to people who were determined to be in the area of the clashes and told them “we will hold you accountable” for acts of violence.

The recipients included both Palestinian residents of east Jerusalem, as well as Palestinian citizens of Israel. While some recipients had participated in the clashes, many others, such as people who lived, worked or prayed in the area, received the message erroneously and said they were surprised or scared by the message.

CORONAVIRUS PANDEMIC
Strained US hospitals seek foreign nurses amid visa windfall
Japan border policy keeps thousands of foreigners in limbo
Officials urge mask-wearing for fans attending Super Bowl
S. Korea expands rapid testing amid record COVID infections
The Association for Civil Rights in Israel, a civil-society group, filed a complaint to the office of Attorney General Avichai Mandelblit, urging him to halt the use of the technology. It cited the use of the tool on a large group of people and the threatening language of the text.

In its response, the attorney general’s office acknowledged there had been problems with the message, both with its language and because the mass distribution included unintended targets. But it said the use of the technology was a legitimate security tool and that the security service has revised its procedures to avoid similar mistakes in the future.

“After discussions with us on this subject, lessons were learned in the security agency and guidelines formulated in various aspects with the goal of preventing a recurrence of problems like this,” said the opinion. It said the office planned no further intervention in the matter.

Tuesday was the final day of Mandelblit’s six-year term. The Association for Civil Rights in Israel, or ACRI, expressed disappointment with the ruling.

“They say they have the authority to continue sending these kind of texts to people,” said Gil Gan-Mor, who heads the group’s unit on human rights in the digital age. “We think differently.”

He said authorities have tools to investigate and prosecute people suspected in violence, but sending threatening messages was not the way to maintain security.

“Obviously this will have a chilling effect, to say the least, on practicing legitimate activities, like going to a protest or going to pray somewhere,” he said. The group was studying the decision and would decide in the coming days whether to file an appeal to the Israeli Supreme Court, he added.

ACRI has previously filed legal challenges to the government’s use of the same Shin Bet tracking technology as a contact-tracing tool to prevent the spread of the coronavirus early in the pandemic.

Israel’s Supreme Court eventually restricted the use of the tool to specific cases, and studies have found that it was largely ineffective in identifying people with COVID-19.",TRUE,https://apnews.com/article/coronavirus-pandemic-technology-health-middle-east-jerusalem-add10954e1bd38eb68c3d7a7c276d48d,Politics,AP
0,Tesla recall: ‘Full Self-Driving’ software runs stop signs,"DETROIT (AP) — Tesla is recalling nearly 54,000 cars and SUVs because their “Full Self-Driving” software lets them roll through stop signs without coming to a complete halt.

Recall documents posted Tuesday by U.S. safety regulators say that Tesla will disable the feature with an over-the-internet software update. The “rolling stop” feature allows vehicles to go through intersections with all-way stop signs at up to 5.6 miles (9 kilometers) per hour.

The recall shows that Tesla programmed its vehicles to violate the law in most states, where police will ticket drivers for disregarding stop signs. The Governors Highway Safety Association, which represents state highway safety offices, said it is not aware of any state where a rolling stop is legal.

Tesla agreed to the recall after two meetings with officials from the National Highway Traffic Safety Administration, according to documents. Tesla said in documents that it knows of no crashes or injuries caused by feature.

The recall covers Model S sedans and X SUVs from 2016 through 2022, as well as 2017 to 2022 Model 3 sedans and 2020 through 2022 Model Y SUVs.

Selected Tesla drivers are “beta testing” the “Full Self-Driving” software on public roads. The company says the cars cannot drive themselves and drivers must be ready to take action at all times.

A firmware release to disable the rolling stops is expected to be sent out in early February.

Tesla, which disbanded its media relations department, did not comment Tuesday.

NHTSA says failing to stop for a sign can increase the risk of a crash. “The Vehicle Safety Act prohibits manufacturers from selling vehicles with defects posing unreasonable risks to safety, including intentional design choices that are unsafe,” the agency said. “If the information shows that a safety risk may exist, NHTSA will act immediately.”

Tesla introduced the “rolling stop” feature in a software update that was sent out to the testing owners on Oct. 20, 2020. NHTSA met with Tesla on Jan. 10 and 19 this year to discuss how the software operates, the documents said. On Jan. 20, the company agreed to disable the rolling stops with the software update.

The “rolling stop” feature let the Teslas go through all-way stop signs as long as the owner enabled the function. The vehicles have to be traveling below 5.6 mph while approaching the intersection, and no “relevant” moving cars, pedestrians or bicyclists can be detected nearby. All roads leading to the intersection had to have speed limits of 30 mph or less, the documents said. The Teslas would then be allowed to go through the intersection at 0.1 mph to 5.6 mph without coming to a complete stop.

Philip Koopman, a professor of electrical and computer engineering at Carnegie Mellon University, said 4-way stop signs are commonly placed to protect intersections for children when no crossing guard is present. He said Tesla’s “machine learning” system can mistakenly identify objects. “What happens when FSD decides a child crossing the street is not ‘relevant’ and fails to stop?” he asked. “This is an unsafe behavior and should never have been put in vehicles.”

Koopman said traveling through a stop sign at 5.6 mph is akin to treating it as a yield sign.

Jonathan Adkins, executive director of the governors safety association, said he’s not surprised that Tesla programmed vehicles to violate state laws. “They keep pushing the bounds of safety to see what they can get away with, and they’ve really been pushing a lot,” he said. “Each time it’s just a little bit more egregious. It’s good to see NHTSA is pushing back.”

The automaker should make safety a priority “not taking advantage of some of our worst behaviors on the road,” Adkins said.

In November, NHTSA said it was looking into a complaint from a California Tesla driver that the “Full Self-Driving” software caused a crash. The driver complained to the agency that a Model Y went into the wrong lane and was hit by another vehicle. The SUV gave the driver an alert halfway through the turn, and the driver tried to turn the wheel to avoid other traffic, according to the complaint. But the car took control and “forced itself into the incorrect lane,” the driver reported. No one was hurt in the Nov. 3 crash.

In December, Tesla agreed to update its software to prevent video games from being played on center touch screens while its vehicles are moving.

NHTSA also is investigating why Teslas using the company’s less-sophisticated “Autopilot” driver-assist system have repeatedly crashed into emergency vehicles parked on roadways.

Last week Tesla said in its earnings release that “Full Self-Driving” software is now being tested by owners in nearly 60,000 vehicles in the U.S. It was only about 2,000 in the third quarter. The software, which costs $12,000, will accelerate Tesla’s profitability, the company said.

CEO Elon Musk said he’d be shocked if the software can’t drive more safely than humans this year. In 2019, Musk predicted a fleet of autonomous Tesla robotaxis on the roads by the end of 2020.

Shares of Tesla, down more than 20% since peaking at $1,229.91 on Nov. 4, slipped about 1% Tuesday.",TRUE,https://apnews.com/article/tesla-recall-full-self-driving-software-e23d252ac5164cb0e7af776625b15180,Technology,AP
0,Japanese game maker Nintendo’s profits hurt by chips crunch,"TOKYO (AP) — Nintendo’s profit for the nine months through December slipped 2.5%, as shortages of computer chips hurt production, the Japanese video game maker behind the Super Mario and Pokemon franchises said Thursday.

Kyoto-based Nintendo Co. recorded a 367 billion yen ($3.2 billion) profit for the period, down from 377 billion yen the previous year. Its sales in the same period fell 6% to 1.3 trillion yen ($11 billion).

Game makers have reaped windfall profits from more people staying home during the pandemic. But sales of Nintendo Switch consoles had more momentum in the previous fiscal year, driven by its hit “Animal Crossing: New Horizons.”

Console sales are often driven by hit games, although the devices tend to sell better early on and then slowly decline in popularity.

Nintendo cut its forecast for Switch console sales for the fiscal year through March to 23 million machines. It had forecast 24 million units, previously slashed from an projection of 25.5 million units.

President Shuntaro Furukawa has said the dearth of computer chips has hindered output, complicating planning for the next fiscal year and beyond.

TECHNOLOGY
Amazon reports strong 4Q results despite supply chain snags
Meta, formerly Facebook, faces historic drop as stock tanks
Shares of Facebook parent Meta plunge 23% on lower profits
Congress takes up controversy over 5G service near airports
The problem has also slowed the design process for its next game machine. Nintendo is developing a device to follow the Switch.

Despite the setbacks, more than 100 million Switch machines have sold so far globally. Its most popular games for the latest period were “Pokémon Brilliant Diamond” and “Pokémon Shining Pearl,” and new Mario Kart and Mario Party games.

“Pokemon Legends Arceus,” which went on sale last month, and the latest Kirby game, set for release in March, are expected to boost sales in the final fiscal quarter, according to Nintendo.

Nintendo faces stiff competition both from longtime rivals such as Microsoft Corp. and Sony Corp. and from newcomers like Netflix and Google.

Microsoft recently announced it’s acquiring Activision Blizzard, the maker of Candy Crush and Call of Duty, for $68.7 billion, turning the maker of the Xbox into one of the world’s largest game companies.

Sony, which makes the PlayStation series of consoles, is acquiring Bungie Inc., known for its Halo and Destiny games, for $3.6 billion. Such acquisitions add game titles under their wings and in effect dwarf Nintendo.

Nintendo expects to post a 400 billion yen ($3.5 billion) profit on 1.65 trillion yen ($14 billion) sales for the fiscal year through March.",TRUE,https://apnews.com/article/technology-business-japan-games-video-games-f6f6c32f6b92f39c90206db030304f57,"Business, Technology",AP
